{
  "schema_version": "1.0.0",
  "catalog_revision": "1",
  "sdk_version": "0.3.1",
  "baseline_commit": "fe6181217eff6044b8f831af3a303a10c6efbb0d",
  "integration_commit": "fe6181217eff6044b8f831af3a303a10c6efbb0d",
  "schema_directory": "src/skillweave_sdk/schemas/execution",
  "digest_algorithm": "sha256",
  "schema_digests": [
    {
      "name": "run-snapshot-v1",
      "schema_id": "https://skillweave.dev/schemas/execution/run-snapshot/v1",
      "path": "run-snapshot-v1.schema.json",
      "digest_sha256": "0ee3b20608a956ad9088c53880c7920ff0053691f2a8ed3c327588bb2b9bf7e8",
      "owner": "sdk",
      "status": "frozen",
      "producer": "sdk contract freeze",
      "consumers": [
        "cli",
        "mcp",
        "observer"
      ],
      "migration": "new opt-in v1 namespace; explicit legacy adapter"
    },
    {
      "name": "attempt-event-v1",
      "schema_id": "https://skillweave.dev/schemas/execution/attempt-event/v1",
      "path": "attempt-event-v1.schema.json",
      "digest_sha256": "fb221a0e051b49c399c304dad57f1882eb71ae481d63f543d5ee6cb963d6473c",
      "owner": "sdk",
      "status": "frozen",
      "producer": "sdk contract freeze",
      "consumers": [
        "cli",
        "mcp",
        "observer"
      ],
      "migration": "new opt-in v1 namespace; explicit legacy adapter"
    },
    {
      "name": "evidence-receipt-v1",
      "schema_id": "https://skillweave.dev/schemas/execution/evidence-receipt/v1",
      "path": "evidence-receipt-v1.schema.json",
      "digest_sha256": "af6e6196a0a5d4841ef3dcfb2ed49b48e249a36a1be7099ce38002fa6149f1b8",
      "owner": "sdk",
      "status": "frozen",
      "producer": "sdk contract freeze",
      "consumers": [
        "cli",
        "mcp",
        "observer"
      ],
      "migration": "new opt-in v1 namespace; explicit legacy adapter"
    },
    {
      "name": "execution-envelope-v1",
      "schema_id": "https://skillweave.dev/schemas/execution/execution-envelope/v1",
      "path": "execution-envelope-v1.schema.json",
      "digest_sha256": "e3e07570727e5785f4d3f1f142ca1ee0a1d92eb6681475a6f702cb8c431bba54",
      "owner": "sdk",
      "status": "frozen",
      "producer": "sdk contract freeze",
      "consumers": [
        "cli",
        "mcp",
        "observer"
      ],
      "migration": "new opt-in v1 namespace; explicit legacy adapter"
    },
    {
      "name": "reservation-v1",
      "schema_id": "https://skillweave.dev/schemas/execution/reservation/v1",
      "path": "reservation-v1.schema.json",
      "digest_sha256": "fc311c7a7ef7b26a8ec4477d7a26dbc14033c1612da70b0791e2b62aca345005",
      "owner": "sdk",
      "status": "frozen",
      "producer": "sdk contract freeze",
      "consumers": [
        "cli",
        "mcp",
        "observer"
      ],
      "migration": "new opt-in v1 namespace; explicit legacy adapter"
    },
    {
      "name": "route-decision-v1",
      "schema_id": "https://skillweave.dev/schemas/execution/route-decision/v1",
      "path": "route-decision-v1.schema.json",
      "digest_sha256": "12a7314d4fccb2685479477425410f76bde16cef171cb635c1413574174230eb",
      "owner": "sdk",
      "status": "frozen",
      "producer": "sdk contract freeze",
      "consumers": [
        "cli",
        "mcp",
        "observer"
      ],
      "migration": "new opt-in v1 namespace; explicit legacy adapter"
    },
    {
      "name": "capability-snapshot-v1",
      "schema_id": "https://skillweave.dev/schemas/execution/capability-snapshot/v1",
      "path": "capability-snapshot-v1.schema.json",
      "digest_sha256": "d2429589b091a287bb5a7d80c78c77b3f6915e14f2c906cd2bd9192a21829d81",
      "owner": "sdk",
      "status": "frozen",
      "producer": "sdk contract freeze",
      "consumers": [
        "cli",
        "mcp",
        "observer"
      ],
      "migration": "new opt-in v1 namespace; explicit legacy adapter"
    },
    {
      "name": "agent-message-v1",
      "schema_id": "https://skillweave.dev/schemas/execution/agent-message/v1",
      "path": "agent-message-v1.schema.json",
      "digest_sha256": "247c971ec76b52d0fe83062e7b051846e5a0d8cb516fbe257045a766a299f44f",
      "owner": "sdk",
      "status": "frozen",
      "producer": "sdk contract freeze",
      "consumers": [
        "cli",
        "mcp",
        "observer"
      ],
      "migration": "new opt-in v1 namespace; explicit legacy adapter"
    },
    {
      "name": "mirror-target-v1",
      "schema_id": "https://skillweave.dev/schemas/execution/mirror-target/v1",
      "path": "mirror-target-v1.schema.json",
      "digest_sha256": "0d922d65d8f825668e2f5a19986753ebf5f36bd7e5ae4e977cbaa29648f47af1",
      "owner": "ops_engine",
      "status": "frozen",
      "producer": "sdk contract freeze",
      "consumers": [
        "cli",
        "mcp",
        "observer"
      ],
      "migration": "new opt-in v1 namespace; explicit legacy adapter"
    },
    {
      "name": "contract-catalog-record-v1",
      "schema_id": "https://skillweave.dev/schemas/execution/contract-catalog-record/v1",
      "path": "contract-catalog-record-v1.schema.json",
      "digest_sha256": "b0e77bf177cf7d2eeeee4bedebfbeadf8e039ecb5ef89906917604cea7848e0d",
      "owner": "router",
      "status": "frozen",
      "producer": "sdk contract freeze",
      "consumers": [
        "cli",
        "mcp",
        "observer"
      ],
      "migration": "new opt-in v1 namespace; explicit legacy adapter"
    }
  ],
  "owners": {
    "sdk": "skillweave-sdk",
    "core": "skillweave Core",
    "ops_engine": "ops-engine",
    "router": "faigate",
    "observer": "gate/observer"
  },
  "compatibility": {
    "legacy_adapter": "skillweave_sdk.validator.adapt_legacy_execution_envelope",
    "note": "flat pre-SW-1510 envelopes adapt explicitly: an unbounded envelope becomes observe_adapt; a finite legacy ceiling/deadline is preserved as an explicit enforcing policy, never silently widened, and one that cannot be represented soundly is rejected"
  }
}
